"rank","headword","pos","english","sample","range","rawFreq","oral","fiction","nonFiction"
2103,"cura","nmf","priest (m), cure (f)","en cambio - dijo - los curas y la iglesia son amigos de los ricos",82,"1141","NA","NA","NA"
1643,"hotel","nm","hotel","pasamos tres días en un hotel de primera clase",88,"1171","high","NA","NA"
1597,"gritar","v","to shout","¡tápate la cabeza! - gritó una voz a mi lado",87,"2232","NA","NA","NA"
773,"exponer","v","to expound, expose","el marido trató de exponer su verdadera situación económica",100,"1454","NA","NA","NA"
235,"hecho","nm","fact, happening","le gustó el hecho de que yo estuviese allí",100,"5914","NA","NA","NA"
1966,"significado","nm","meaning","¿qué significado tiene? ¿Qué importancia le da usted a esto?",89,"821","NA","NA","NA"
2178,"valioso","adj","valuable, precious","M. le entregó el valioso rosario de oro",88,"499","NA","NA","NA"
1118,"seguro","adj","safe, sure, secure","uno se siente muy seguro con un jefe así",99,"1113","NA","NA","NA"
2056,"absorber","v","to absorb, soak up","incapaz aún de absorber la magnitud de su fracaso",92,"577","NA","NA","NA"
2342,"media","nf","average; a medias: halfways","he leído a medias, porque no he terminado de leerla",85,"554","NA","NA","NA"
2396,"homenaje","nm","homage, tribute","rindió homenaje a la patria",87,"412","NA","NA","NA"
433,"respecto","nm","respect, con respecto a: with regards to","los grupos varían con respecto al número que lo componen",100,"3435","NA","NA","NA"
727,"tender","v","to tend to, lay out","la historia tendía a ser endiabladamente repetitiva",100,"1755","NA","NA","NA"
422,"aprender","v","to learn","no hay manera de aprender el otro lenguaje",100,"2995","NA","NA","NA"
1404,"personal","nm","personnel, staff, staffing","el personal que trabaja ahí no lo ve de la misma manera",97,"773","NA","NA","NA"
562,"colocar","v","to place, position","vuelve a colocar las rosas dentro del jarrón",100,"2270","NA","NA","NA"
1981,"doblar","v","to bend, turn","tienes que doblar la esquina que sigue",89,"775","NA","NA","NA"
1964,"personalmente","adv","personally","yo voy a estar controlándolo personalmente",88,"520","high","NA","NA"
643,"físico","adj","physical","su trabajo requería un gran esfuerzo físico",100,"2343","NA","NA","NA"
2122,"exhibir","v","to exhibit, show off","ningún proceso puede exhibir una gama tan amplia de aplicaciones",90,"529","NA","NA","NA"
1349,"norma","nf","standard, pattern, norm","se cumplen las leyes como norma invariable",93,"1547","NA","NA","NA"
2234,"vaca","nf","cow","¿qué productos se sacan de la leche de las vacas?",83,"608","NA","NA","NA"
1695,"hueso","nm","bone","sólo piel y hueso emergían de aquel cuerpo",90,"1163","NA","NA","NA"
1770,"sueldo","nm","salary, pay","me pagó mi sueldo y me despidió",90,"652","high","NA","NA"
1165,"partida","nf","game, match, departure","juega una partida de ajedrez con la muerte",99,"1120","NA","NA","NA"
1820,"efectivo","adj","effective","¿cuál es el tratamiento más efectivo a aplicar?",94,"959","NA","NA","NA"
1825,"biblioteca","nf","library","este manuscrito está en la Biblioteca Nacional",90,"781","NA","NA","NA"
160,"solo","adj","lonely, alone","se sentía solo, espantosamente solo",100,"8784","NA","NA","NA"
869,"completamente","adv","completely","me olvidé completamente de mí misma",100,"1286","NA","NA","NA"
1071,"saltar","v","to jump, leap, hop","saltó por la ventanita y echó a correr",96,"1512","NA","NA","NA"
2335,"bienestar","nm","wellbeing, welfare","su existencia dependía la salud y el bienestar de mucha gente",89,"455","NA","NA","NA"
2052,"pata","nf","leg, paw","casi la golpea con una de las patas de la mesa",86,"851","NA","NA","NA"
828,"visita","nf","visit, visitor, guest","tras una visita a la ciudad de San Francisco",100,"1736","NA","NA","NA"
479,"indicar","v","to indicate","el Conductor le indica el lugar que debe ocupar",100,"2608","NA","NA","NA"
1129,"método","nm","method","me impresiona mucho su método científico de investigación",96,"2541","NA","NA","NA"
2471,"repetido","adj","repeated","hablé con él en repetidas ocasiones",88,"381","NA","NA","NA"
1098,"accidente","nm","accident, irregularity","un hilo de sangre en la boca después del horrible accidente",100,"908","NA","NA","NA"
60,"primero","adj","first","las primeras palabras que nos enseñan a leer y escribir",100,"26553","NA","NA","NA"
2421,"alcohol","nm","alcohol","lo que matan más que la heroína que es el tabaco y el alcohol",81,"689","NA","NA","NA"
1674,"mental","adj","mental","la actividad mental que expresa una aguda realidad psíquica",95,"894","NA","NA","NA"
2384,"optar","v","to choose, opt for","a pesar de todo, optó por lo peor",89,"526","NA","NA","NA"
2082,"extensión","nf","extension, area, expanse","lo que equivale a doce veces la extensión de España",90,"953","NA","NA","NA"
755,"puesto","nm","job, place, position","me ofrecieron un puesto como redactora para la América Latina",100,"1476","NA","NA","NA"
424,"muerte","nf","death","sólo la muerte no tiene remedio, Juan",98,"5332","NA","NA","NA"
2109,"proporción","nf","proportion","no tiene población en proporción a su territorio",90,"815","NA","NA","NA"
775,"ciencia","nf","science, knowledge","han sostenido que incluso la ciencia no es tan racional como se supone",98,"2566","NA","NA","NA"
2321,"hielo","nm","ice","todo esto ya es agua y nieve, el hielo se está fundiendo",82,"677","NA","NA","NA"
1578,"automóvil","nm","automobile","era un automóvil Chevrolet último modelo de la década del 50",93,"976","NA","NA","NA"
502,"significar","v","to mean","la paloma azul debía significar la libertad",100,"2792","NA","NA","NA"
2020,"reina","nf","queen","sentada como la reina en su trono",91,"631","NA","NA","NA"
168,"éste","pron","this one (m), [ésta (f)]","¿qué esperabas de un lugar como éste?",100,"9298","NA","NA","NA"
153,"cual","pron","which, who, whom","el pañuelo con el cual me limpié",100,"9802","NA","NA","NA"
1027,"idioma","nm","(specific) language","habla en un idioma extraño",96,"1297","NA","NA","NA"
216,"grupo","nm","group","¿cuál será su papel en ese grupo de trabajo?",100,"7948","NA","NA","NA"
872,"mío","pron","mine","mozo, otro café igual al mío",89,"3943","high","NA","low"
176,"palabra","nf","word","jamás dijo una palabra en inglés",100,"8640","NA","NA","NA"
883,"sostener","v","to support, hold up","subimos a la plataforma que sostenía la cama",98,"2203","NA","NA","NA"
1874,"pobreza","nf","poverty, lack, scarcity","la pobreza y la desigualdad son problemas antiguas",93,"654","NA","NA","NA"
888,"oscuro","adj","dark, obscure","estás en el punto más oscuro del bosque",96,"2292","NA","NA","NA"
2226,"principalmente","adv","principally, mainly","esto es lo que principalmente nos ha preocupado",86,"851","NA","NA","NA"
1757,"redondo","adj","round","una luna inmensa, redonda, amarilla, brillaba en el cielo",91,"755","NA","NA","NA"
2722,"entretener","v","to entertain, amuse","trajo juguetes para entretener al nuevo amiguito",79,"408","NA","NA","low"
246,"cambiar","v","to change","no van a cambiar las relaciones de poder",100,"5595","NA","NA","NA"
845,"educación","nf","education","y nada contribuye más a ellas que la educación y la cultura",98,"2441","high","NA","NA"
635,"boca","nf","mouth, entrance, opening","cállese la boca, hijo, que estamos estudiando",98,"3688","NA","NA","NA"
108,"momento","nm","moment, time","estaba pasando uno de los peores momentos de mi vida",100,"14918","NA","NA","NA"
1481,"ciego","adj","blind","ha tenido una fe ciega en aquella criatura",94,"946","NA","NA","NA"
165,"lado","nm","side","está situada al lado derecho",100,"8293","NA","NA","NA"
133,"país","nm","country","de todos los países de las Américas",100,"15588","NA","NA","NA"
352,"ser","nm","being","se puede ser un ser humano perfecto y un bárbaro en cultura",100,"4601","NA","NA","NA"
167,"allí","adv","there, over there","allí están, junto a la playa",100,"9806","NA","NA","NA"
1929,"suspender","v","to suspend, hang, fail","tuvieron que suspender las transmisiones de radio",94,"608","NA","NA","NA"
2173,"propuesta","nf","proposal, proposition","ustedes hacen una propuesta que favorece a los minusválidos",83,"1722","NA","low","NA"
819,"artículo","nm","article, product, item","no podía concentrarse en el artículo que estaba escribiendo",100,"2147","NA","NA","NA"
1392,"pan","nm","bread","ni hay agua ni hay peces ni pan para darle de comer",94,"1132","NA","NA","NA"
849,"raro","adj","strange, rare, scarce","no sé; me suena raro lo que dicen ustedes",99,"1729","NA","NA","NA"
694,"salida","nf","exit, escape, outcome","quizá por miedo a meterse en un callejón sin salida",99,"1859","NA","NA","NA"
2377,"esclavo","nm","slave","no se sentía libre sino esclavo de una fuerza interior",83,"605","NA","NA","NA"
1284,"débil","adj","weak","una ampolleta eléctrica echaba una débil luz sobre nosotros",98,"928","NA","NA","NA"
326,"valor","nm","value, worth","hay que descubrir el valor artístico de la obra de arte",100,"4350","NA","NA","NA"
1585,"corregir","v","to correct, rectify","vamos a corregir algunos errores",95,"712","NA","NA","NA"
806,"máquina","nf","machine","una máquina que convierte la energía mecánica en eléctrica",98,"1879","NA","NA","NA"
948,"adecuado","adj","adequate, suitable","buscó el lugar adecuado donde plantar su nido",97,"1819","NA","NA","NA"
254,"distinto","adj","distinct, different","abrirían las puertas a un futuro distinto para mí",100,"6225","NA","NA","NA"
190,"perder","v","to lose, miss","el golpe me hizo perder el equilibrio",100,"7788","NA","NA","NA"
307,"final","nmf","al final: finally, in the end","pero al final, el resultado es la perfección",100,"4770","NA","NA","NA"
387,"valer","v","to be worth, cost","¡estas joyas tienen que valer muchos millones!",100,"3341","high","NA","NA"
407,"fijar","v","to set, fix, [se] notice","lo primero que hizo fue fijar fecha definitiva",100,"2929","high","NA","NA"
978,"afirmar","v","to assert, affirm","afirmó que E. pertenecía a una horrible clase de hombre",97,"2574","NA","NA","NA"
1235,"mañana","adv","tomorrow","¿Entonces mañana va a comer otra vez…?",88,"1778","high","NA","low"
2287,"vela","nf","candle, sail, vigil","llevaba un candelabro con una sola vela",84,"795","NA","NA","NA"
1086,"fundamental","adj","fundamental","es un paso fundamental en el proceso",95,"2370","high","NA","NA"
949,"introducir","v","to introduce, bring in","ahorita se pueden introducir las nuevas tecnologías",99,"1769","NA","NA","NA"
1897,"cálculo","nm","calculation, calculus","además, ya hizo su aritmética y su cálculo de costos",92,"606","NA","NA","NA"
2212,"normalmente","adv","normally","sí, normalmente es un tipo bastante práctico",84,"908","high","low","NA"
1705,"actor","nm","actor","había logrado un notable éxito como dramaturgo y actor teatral",88,"1199","NA","NA","NA"
1564,"inútil","adj","useless","yo trataba de calmarlas pero era inútil",92,"1139","NA","NA","NA"
1716,"hierro","nm","iron","construyeron un puente moderno de hierro",90,"1276","NA","NA","NA"
320,"voz","nf","voice","un hombre de voz vibrante y rica empezó a cantar",100,"6853","NA","NA","NA"
1108,"facilidad","nf","ease, facility","es un hombre inteligente con una gran facilidad de expresión",98,"838","NA","NA","NA"
644,"actitud","nf","attitude","hay que tener siempre una actitud de metódico escepticismo",99,"2599","NA","NA","NA"
506,"política","nf","politics, policy","se lanzan a un frenético debate sobre política",100,"4678","NA","NA","NA"
2068,"educar","v","to educate","se tiene que educar, se tiene que preparar",88,"517","high","NA","NA"
2274,"castigar","v","to punish","Dios nos castiga por tantos pecados cometidos",87,"538","NA","NA","NA"
386,"pie","nm","foot, base","está enfermo y tiene un pie en el cementerio",100,"5048","NA","NA","NA"
277,"papel","nm","paper, role, part","el poco papel que tenemos lo dedicamos a libros",100,"4628","NA","NA","NA"
575,"pena","nf","trouble; valer la pena: be of worth","ésa es una cosa que sí vale la pena recordarla",98,"2309","high","NA","NA"
199,"nombre","nm","name, noun","Susana no es mi nombre verdadero",100,"7132","NA","NA","NA"
965,"recuperar","v","to recuperate, recover","pareció recuperar parte de sus menguadas fuerzas",98,"1480","NA","NA","NA"
1134,"arrastrar","v","to drag, pull","el abuelo arrastró su sillón hasta la ventana",98,"1489","NA","NA","NA"
2124,"fresco","adj","cool, healthy, fresh","una brisa fresca, que luego se convirtió en vendaval",88,"805","NA","NA","NA"
885,"delante","adv","(in) front (of), ahead","el caballo marchaba delante y a la derecha",97,"1681","NA","NA","NA"
2360,"fantástico","adj","fantastic, unreal","el mundo imaginario y fantástico soñado por Mozart",85,"479","NA","NA","NA"
1900,"huevo","nm","egg","entierran los huevos en nidos que construyen en la tierra",86,"933","NA","NA","NA"
258,"santo","nm","saint (m)","todos iban detrás del Santo Patrono con rezos y cánticos",100,"6218","NA","NA","NA"
1314,"triste","adj","sad, unhappy","era sujeto silencioso y triste que vivía aislado",92,"1538","NA","NA","NA"
2519,"relativamente","adv","relatively","esta distinción es relativamente reciente; no es anterior al siglo XIX",85,"696","NA","low","NA"
1860,"primo","nm","cousin","porque eran las mamás, los papás, los tíos, los primos",89,"865","NA","NA","NA"
1986,"olor","nm","smell, odor, fragrance","sentí que el olor de café venía de la cocina",84,"1798","NA","NA","NA"
744,"familiar","adj","familiar, of the family","por tradición, el negocio familiar pasa a los hijos",100,"1489","NA","NA","NA"
659,"comunicación","nf","communication","la falta de comunicación es nuestra principal limitación",100,"2303","high","NA","NA"
329,"alcanzar","v","to reach, catch up with","la economía tiene posibilidades de alcanzar la prosperidad",100,"4803","NA","NA","NA"
1869,"denominar","v","to call, name","lo que algo se denomina ahora «movilidad social»",87,"2167","NA","low","NA"
1748,"sujeto","nm","subject, individual","el hombre es el sujeto de los beneficios de la economía",92,"985","NA","NA","NA"
1729,"tranquilidad","nf","tranquility, peace","hay tranquilidad; hay sensación de que las cosas funcionan bien",93,"566","high","NA","NA"
1821,"victoria","nf","victory, triumph","una importante victoria sobre una poderosa fuerza militar",90,"1151","NA","NA","NA"
69,"ella","pron","she, [ellas] them (f)","ella es muy estudiosa",100,"24770","NA","NA","NA"
361,"experiencia","nf","experience","tengo experiencia de la vida y del amor",100,"3568","NA","NA","NA"
769,"público","nm","public, audience","lo que me motiva es el contacto con el público",100,"1900","NA","NA","NA"
454,"cerrar","v","to close","lo mejor era cerrar los ojos y dormir",100,"3099","NA","NA","NA"
2043,"definido","adj","definite","tenía la sensación de andar hacia algo definido y concreto",93,"586","NA","NA","NA"
793,"santa","nf","saint (f)","el 30 de agosto es también la fiesta de Santa Rosa de Lima",98,"1845","NA","NA","NA"
1419,"entrevista","nf","interview, meeting","en la segunda entrevista no se puede decir «nunca»",94,"938","NA","NA","NA"
2177,"odio","nm","hatred","no me mueve el odio sino el amor",89,"635","NA","NA","NA"
707,"estilo","nm","style","la casa era de estilo antiguo, con una gran galería al frente",98,"2907","NA","NA","NA"
405,"acción","nf","action, act, deed","esta acción legal pretendía acelerar la liberalización económica",100,"4397","NA","NA","NA"
1394,"sano","adj","healthy, wholesome","era un animal sano, fuerte y hermoso",96,"739","NA","NA","NA"
116,"casa","nf","house","hoy la gente vive en la calle; no vive en su casa",100,"16408","NA","NA","NA"
2125,"mando","nm","command, authority","vamos a darte el mando de todos esos para defender la paz",89,"790","NA","NA","NA"
592,"imposible","adj","impossible","estaba muy oscuro y era imposible verla",100,"2138","NA","NA","NA"
2196,"acomodar","v","to be/make comfortable","ella se acomodó entre los almohadones y leyó",89,"588","NA","NA","NA"
1898,"composición","nf","composition, make-up, essay","para conocer la composición de las estructuras de DNA",92,"994","NA","NA","NA"
972,"tono","nm","tone","habla de forma pausada y en tono bajo",97,"1804","NA","NA","NA"
1387,"temer","v","to fear","empecé a temer que una bomba atómica iba a caer",94,"1388","NA","NA","NA"
1623,"vacaciones","nf","vacation","iba a pasar vacaciones en Viña del Mar",90,"660","high","NA","NA"
1105,"casar","v","to marry","se casó a los quince años con el dueño de una peluquería",90,"2023","high","NA","NA"
605,"memoria","nf","memory","habla pausadamente, buscando en la memoria la palabra exacta",99,"2426","NA","NA","NA"
2000,"índice","nm","index, forefinger","un país pequeño, pobre, con un índice de desarrollo humano bajísimo",91,"746","NA","NA","NA"
1657,"transporte","nm","transportation, transport","Iberia ha detentado el monopolio del transporte aéreo español",95,"953","NA","NA","NA"
878,"verde","adj","green","los vegetales de hoja verde, como las espinacas y la col",97,"2092","NA","NA","NA"
1782,"fortuna","nf","fortune, fate","a los seis meses, su fortuna pasaba de quinientos mil pesos",92,"795","NA","NA","NA"
1563,"órgano","nm","organ","el corazón es un órgano que sirve para enviar sangre a los pulmones",94,"1298","NA","NA","NA"
369,"descubrir","v","to discover","otro policía descubrió un paquete en el suelo",100,"4206","NA","NA","NA"
935,"masa","nf","mass, dough, bulk, crowd","para determinar la masa atómica de diversos elementos",99,"1984","NA","NA","NA"
2322,"gobernar","v","to govern","gobernar no es solamente administrar un Estado",87,"820","NA","NA","NA"
558,"entregar","v","to deliver","entregó el paquete a las criaturas",99,"2323","NA","NA","NA"
763,"amplio","adj","wide, ample, broad","se encontraba en el amplio y fresco corredor de una vivienda",98,"2220","NA","NA","NA"
2386,"lágrima","nf","tear, teardrop","tenía lágrimas en los ojos",80,"1107","NA","NA","NA"
557,"matar","v","to kill","el gato sirve para matar a los ratones",98,"3175","NA","NA","NA"
2325,"primavera","nf","spring, spring-like","en la primavera el clima es templado",84,"634","NA","NA","NA"
346,"diez","num","ten","a mí me bastaban los diez mandamientos",100,"3740","high","NA","NA"
1527,"reserva","nf","reservation, reserve","abandonando toda reserva, le puso delante la realidad desnuda",95,"933","NA","NA","NA"
1151,"describir","v","to describe","no te voy a describir la escena",98,"1461","NA","NA","NA"
1859,"diente","nm","tooth, cog","la Biblia dice «ojo por ojo y diente por diente»",85,"1465","NA","NA","NA"
2244,"parado","adj","stopped, standing","vio a varios pájaros parados en una rama",85,"603","NA","NA","NA"
716,"merecer","v","to deserve, be worthy (of)","un interesante artista viajero que merece la pena conocer",99,"1474","NA","NA","NA"
2412,"arco","nm","arch, arc, bow","me condujo bajo el arco de la puerta principal",84,"682","NA","NA","NA"
1593,"soñar","v","to dream","yo soñaba con ser piloto",89,"1235","NA","NA","NA"
390,"servicio","nm","service, helpfulness","es un servicio público que beneficia al individuo",100,"3835","NA","NA","NA"
322,"necesario","adj","necessary","ahora es necesario dirigir más oraciones a Dios",100,"4662","NA","NA","NA"
1459,"canción","nf","song","sonarán el himno nacional y la canción catalana «Els Segadors»",90,"1162","NA","NA","NA"
1701,"fruta","nf","fruit","además de frutas como piña, sandía, naranja, papaya y plátano",90,"783","NA","NA","NA"
1938,"explotar","v","to explode, exploit","explotó una bomba en un mercado en Jerusalén",93,"514","NA","NA","NA"
1383,"facultad","nf","faculty, ability","es mucho más fácil enseñar en la Facultad de Educación",95,"936","NA","NA","NA"
1608,"sumar","v","to add up, amount to","los diputados sumaron 64 votos en favor",94,"822","NA","NA","NA"
2481,"cierre","nm","zipper, closing","hasta que el cierre de la mochila revienta y vuela el contenido",87,"378","NA","NA","NA"
80,"hombre","nm","man, mankind, husband","yo soy un hombre de pocas necesidades",100,"20292","NA","NA","NA"
349,"tu","adj","your (sg/+fam)","ésta es tu casa y ésta es tu cama",91,"10913","high","NA","low"
777,"mas","conj","but, however","es posible mas lo dudo",95,"2046","NA","NA","NA"
2455,"almacén","nm","warehouse, store","fue hasta el almacén a buscar alguna cosa que faltaba",83,"545","NA","NA","NA"
814,"aquello","pron","that over there (n)","aquello era un palacio",96,"2184","NA","NA","NA"
998,"montar","v","to ride, mount, assemble","vieron que yo montaba bien a caballo",97,"1282","NA","NA","NA"
1199,"cuándo","adv","when?","¿Cuándo vuelven? – preguntó",94,"1298","high","NA","NA"
856,"militar","adj","military","las autoridades civiles y militares harán respetar esta decisión",98,"2702","NA","NA","NA"
1205,"placer","nm","pleasure","Es siempre un gran placer caminar junto a ti",94,"1430","NA","NA","NA"
2156,"desesperado","adj","desperate, hopeless","estaba desesperado por el hambre y la humillación",86,"683","NA","NA","NA"
2045,"cita","nf","appointment, date, quotation","nos gustaría tener una cita con usted",88,"600","NA","NA","NA"
1982,"disminuir","v","to decrease, diminish","debemos combatir la pobreza y disminuir la desigualdad",90,"985","NA","NA","NA"
1845,"conmigo","pron","with me","dime que no estás enfadado conmigo",82,"1668","high","NA","low"
915,"justo","adv","just","está colocada en el medio - justo frente a la silla",98,"1296","NA","NA","NA"
1378,"virtud","nf","virtue, quality","es una gran virtud ser disciplinado",96,"1107","NA","NA","NA"
1708,"agregar","v","to add, gather","nadie era capaz de agregar nada a lo dicho",90,"1562","NA","NA","NA"
342,"pagar","v","to pay","estamos tratando de pagar esta deuda",100,"4130","NA","NA","NA"
563,"metro","nm","meter, subway","produce kilogramos de vegetales por metro cuadrado",99,"2305","NA","NA","NA"
68,"tiempo","nm","time (general), weather","he estado mucho tiempo con ella",100,"22432","NA","NA","NA"
1613,"versión","nf","version, account","presentó en Londres la versión inglesa de sus crónicas",94,"984","NA","NA","NA"
2029,"universitario","adj","university","fue profesor universitario de física teórica",85,"868","high","NA","NA"
416,"realmente","adv","really, actually, in fact","¿antes de nacer nosotros existía realmente el mundo?",99,"3824","high","NA","NA"
971,"probablemente","adv","probably","probablemente después de misa se viene a cocinar",99,"1261","NA","NA","NA"
1289,"ceder","v","to give way, yield","necesitaremos ceder mucho para llegar a un acuerdo",99,"860","NA","NA","NA"
2275,"rechazo","nm","rejection, refusal","me da pena el rechazo de mis padres",91,"480","NA","NA","NA"
2017,"legal","adj","legal","al pueblo una norma legal para empresarios y obreros",91,"987","NA","NA","NA"
1528,"regalar","v","to give (as a gift)","a mi tía nunca le gustó regalar dinero",90,"979","high","NA","low"
NA,"estrategia","nf","strategy","hay que desarrollar una estrategia de alianzas y de pactos",85,"951","NA","NA","NA"
2327,"simpatía","nf","sympathy, affinity","nos mirábamos con simpatía porque los dos nos entendíamos",86,"464","NA","NA","NA"
2480,"bloque","nm","block","la integración de sus miembros en un bloque económico regional",86,"565","NA","NA","NA"
690,"dispuesto","adj","willing, ready","estaba dispuesto a hacer cualquier sacrificio por la Patria",100,"1940","NA","NA","NA"
509,"reunir","v","to gather, meet, collect","le permitieron reunir una fortuna de proporciones grotescas",100,"2237","NA","NA","NA"
1851,"hilo","nm","thread, yarn, wire","la manipulación del hilo de seda fue un proceso secreto",92,"871","NA","NA","NA"
447,"resto","nm","rest, remainder, leftover","en el Perú y Japón sí, pero no en el resto del mundo",100,"3279","NA","NA","NA"
119,"tres","num","three","tres direcciones: diagonal, horizontal y vertical",100,"12786","NA","NA","NA"
1053,"culpa","nf","blame, fault","oígame, que yo no tengo la culpa si he perdido la documentación",95,"1598","NA","NA","NA"
2340,"plenamente","adv","fully","y en esto coincidía plenamente con su amigo",89,"388","NA","NA","NA"
1063,"referencia","nf","reference, allusion","en su cuaderno no hay ninguna referencia a su pecado",98,"1300","NA","NA","NA"
1237,"político","nm/f","politician","la reelección como el político más popular",97,"1248","NA","NA","NA"
1016,"riesgo","nm","risk","lo preocupante para mí es el riesgo de que nos descubran",98,"1765","NA","NA","NA"
1423,"confiar","v","to trust, confide","me contó que confía en Dios y lee la Biblia",96,"894","NA","NA","NA"
2297,"pariente","nc","relative","no tenía amigo ni pariente en quien confiar",85,"704","NA","NA","NA"
1767,"independencia","nf","independence","para festejar el cumpleaños de la Independencia de la Patria",91,"1093","NA","NA","NA"
1005,"poseer","v","to possess, own","el libro posee una calidad estética notable",96,"2134","NA","NA","NA"
462,"real","adj","royal, real, authentic","fuimos a la biblioteca del palacio real de Madrid",100,"3671","NA","NA","NA"
2361,"liberación","nf","liberation","tras la liberación de del territorio de la dominación alemana",91,"471","NA","NA","NA"
2548,"trampa","nf","trick, trap; hacer trampa: to cheat","sino a la vida natural, normal, es decir, a no hacer trampa",84,"531","NA","NA","NA"
1940,"despedir","v","to say goodbye (to), dismiss","se despidió de cada uno, y después fue a su casa",87,"1129","NA","NA","NA"
1164,"barco","nm","boat, ship","me sentí perdido en medio de aquel barco y de aquel océano",93,"1841","NA","NA","NA"
1530,"quejar","v","to complain","se quejaba de dolencias de viejo",92,"763","high","NA","NA"
527,"representar","v","to represent","representa uno de los aspectos más desconocidos",100,"3312","NA","NA","NA"
2180,"agudo","adj","sharp, acute","tiene un agudo espíritu crítico, no soporta el desorden",87,"705","NA","NA","NA"
