"rank","headword","pos","english","sample","range","rawFreq","oral","fiction","nonFiction"
591,"simplemente","adv","simply, just","me visitan simplemente por ser familia",100,"2188","high","NA","NA"
394,"tercero","adj","third","en uno de los primeros años de la tercera década del siglo",100,"3390","NA","NA","NA"
1804,"canal","nm","channel, canal","estamos en contra de privatizar el canal de televisión",92,"982","NA","NA","NA"
1469,"maestro","adj","master","esperaba poder escribir por fin su obra maestra",94,"746","NA","NA","NA"
1831,"continente","nm","continent","el continente africano ha tenido muchos cambios climáticos",93,"864","NA","NA","NA"
2152,"afán","nm","eagerness, zeal, effort","lo que no me parece bien es este afán de consumismo",90,"511","NA","NA","NA"
2210,"variar","v","to change, vary","el hecho de variar de actividad y de salir de la rutina",87,"893","NA","low","NA"
2419,"caos","nm","chaos","el desarrollo mundial hoy es un caos, una anarquía",91,"301","NA","NA","NA"
1040,"obligación","nf","obligation","moralmente, mi obligación es proteger al niño",98,"1370","NA","NA","NA"
2128,"preparación","nf","preparation, training","nuevas perspectivas en la preparación de vacunas contra el sida",90,"758","NA","low","NA"
2454,"prender","v","to turn on, apprehend","no veía nada y no quería prender la linterna",82,"691","NA","NA","low"
1311,"juventud","nf","youth","un recorrido biológico por la infancia, la pubertad y la juventud",93,"1205","NA","NA","NA"
2069,"comprometer","v","to compromise","no quería comprometer su carrera abogando por un preso político",92,"548","NA","NA","NA"
10,"no","adv","no","no hay modo de negar nada",100,"257365","high","NA","NA"
2065,"pista","nf","clue, track, trace","dará una pista definitiva para resolver esta cuestión",88,"852","NA","NA","NA"
1242,"ejercicio","nm","exercise, practice","no puedo intervenir en el ejercicio de sus funciones",95,"1453","NA","NA","NA"
614,"interior","nm","interior, inside","comían en el interior y otros al aire libre",100,"2088","NA","NA","NA"
2395,"instalación","nf","installation, facilities","existe un proyecto de instalación de videocámaras",87,"638","NA","low","NA"
1293,"atraer","v","to attract","queremos atraer la atención de los hombres",98,"900","NA","NA","NA"
1411,"indio","nm","Indian","me da miedo de que hagan como los españoles con los indios en América",92,"1597","NA","NA","NA"
1784,"suave","adj","soft, gentle, mild","se sentía un viento suave de otoño",92,"997","NA","NA","NA"
1718,"completar","v","to complete","voy a completar mi carrera con un curso de filosofía",95,"690","NA","NA","NA"
1248,"dedo","nm","finger, toe, digit","el juez golpeaba con la yema de los dedos sobre los papeles",91,"2580","NA","NA","NA"
805,"esperanza","nf","hope","yo creo que hay que tener fe, esperanza y caridad",98,"1821","NA","NA","NA"
115,"bueno","adj","good","si estaba de buen humor, nos besábamos sin ruido",100,"13138","high","NA","NA"
1513,"obedecer","v","to obey","voy a obedecer a mi padre; voy a cumplir con su deseo",98,"785","NA","NA","NA"
324,"allá","adv","there, over there","miren allá, cerca del puente",100,"5605","NA","NA","NA"
743,"publicar","v","to publish","voy a publicar otro libro con el resto",99,"2192","NA","NA","NA"
2413,"oriente","nm","East","Fernando de Magallanes buscaba una ruta al Oriente",82,"774","NA","NA","NA"
1545,"ajustar","v","to adjust, tighten","ajusta un botón de la chaqueta",97,"611","NA","NA","NA"
1155,"calcular","v","to calculate, figure out","lo ha pensado bien y ha calculado cada palabra",100,"986","NA","NA","NA"
152,"manera","nf","way, manner","lo hizo de manera muy informal",100,"9598","NA","NA","NA"
891,"transformar","v","to transform, change","la política básica fue transformar China en una sociedad socialista",99,"1638","NA","NA","NA"
138,"mayor","adj","larger, older, main","yo trabajé la mayor parte del tiempo",100,"12208","NA","NA","NA"
1959,"forzar","v","to force","un ladrón que trató de forzar la puerta de su casa",95,"530","NA","NA","NA"
1260,"particular","nm","particular, detail, individual","hablo en particular de los antiguos regímenes comunistas",97,"967","NA","NA","NA"
2512,"inicio","nm","beginning, start","es el inicio de una nueva etapa en nuestra vida musical",83,"927","NA","NA","NA"
1213,"cometer","v","to commit","después de cometer el horrendo crimen el asesino se entregó",97,"950","NA","NA","NA"
555,"expresión","nf","expression","Johnny cambió su sonrisa por una expresión concentrada",100,"2473","NA","NA","NA"
2289,"establecimiento","nm","establishment","el establecimiento de conexiones nerviosas entre las células",86,"602","NA","NA","NA"
566,"guardar","v","to keep, save","lo voy a guardar debajo de mi colchón",100,"2528","NA","NA","NA"
86,"parte","nf","part, portion","el arte es una parte tan importante de la cultura",100,"20319","NA","NA","NA"
675,"capacidad","nf","capacity","tenía una gran capacidad para entender los tiempos nuevos",99,"2909","NA","NA","NA"
134,"tratar","v","to try, treat, deal with","eso es precisamente lo que tratamos de evitar",100,"10988","NA","NA","NA"
292,"quién","pron","who?, whom?","¿quién es el padre de su hijo?",99,"6080","high","NA","NA"
224,"varios","adj","several, various","está constituida por varios dialectos",100,"6683","NA","NA","NA"
104,"llamar","v","to call, name","el juez se llamaba Pedro Barreda",100,"14694","NA","NA","NA"
2593,"resumen","nm","summary","concedió una larga entrevista; éste es un resumen de la conversación",83,"336","NA","NA","NA"
403,"continuar","v","to continue","da la orden para continuar la marcha",100,"3856","NA","NA","NA"
1279,"argumento","nm","argument, plot","ha escrito relatos breves con su argumento muy bien determinado",97,"997","NA","NA","NA"
1441,"busca","nf","search, hunt","están a la busca de nuevos mercados",96,"888","NA","NA","NA"
491,"desarrollar","v","to develop","tratando de desarrollar un...nuevo sistema electrónico",100,"3855","NA","NA","NA"
2193,"cuerda","nf","cord, rope","el hombre se echó la cuerda al cuello",85,"784","NA","NA","NA"
1577,"emoción","nf","emotion, excitement","fueron momentos de gran tensión, de gran emoción",92,"1223","NA","NA","NA"
1615,"intervención","nf","intervention","le prometió su intervención ante cualquier emergencia",93,"1409","NA","NA","NA"
2401,"estallar","v","to break out, explode, start","los soldados se prepararon mucho antes de estallar la guerra",84,"770","NA","NA","NA"
631,"abajo","adv","down, below, downward","¿se podría echar abajo la alianza opositora?",99,"2267","NA","NA","NA"
213,"cuanto","adj","en cuanto a: in terms of, regarding","hoy hay más apatía en cuanto a estas cuestiones",100,"6057","NA","NA","NA"
2085,"idéntico","adj","identical","los impactos eran siete, de idéntico tamaño los agujeros",89,"622","NA","NA","NA"
1822,"circular","v","to circulate, go around, flow","el líquido que circula en el interior de estos ventrículos",95,"593","NA","NA","NA"
704,"circunstancia","nf","circumstance","tuvimos que enfrentar una circunstancia económica difícil",100,"1942","NA","NA","NA"
173,"buscar","v","to look for","decidí volver a la calle y buscar un empleo",100,"7882","NA","NA","NA"
1056,"pelo","nm","hair","era rubio y flaco, de pelo corto",95,"2130","NA","NA","NA"
1245,"secretario","nm/f","secretary","así lo indicó el secretario general en una Comisión",94,"1317","NA","NA","NA"
2597,"fundamento","nm","foundation, ground","intentó un entusiasmo que no sentía, algo sin fundamento firme",83,"540","NA","NA","NA"
986,"identificar","v","to identify","permitió identificar con precisión las causas de la contaminación",100,"1207","NA","NA","NA"
2044,"favorecer","v","to favor, help","la relajación favorece tu capacidad de concentración",90,"850","NA","NA","NA"
1558,"temperatura","nf","temperature","su temperatura crítica es de 28 grados Kelvin",93,"1793","NA","NA","NA"
111,"salir","v","to leave, go out","para que le abriese la reja para salir al bosque",100,"14339","NA","NA","NA"
1498,"fábrica","nf","factory, manufacture","en la fábrica se producen cosas de plástico",93,"763","NA","NA","NA"
1756,"moral","nf","morals, ethics","es un compendio de la doctrina y la moral de la Iglesia católica",93,"676","NA","NA","NA"
458,"completo","adj","complete","tienes mi apoyo completo",100,"2437","NA","NA","NA"
542,"asegurar","v","to assure, secure, insure","podía asegurar que él sería la próxima víctima",99,"2899","NA","NA","NA"
2532,"atento","adj","attentive, polite","caminaba con fatiga, demasiado vigilante para estar atento",84,"471","NA","NA","NA"
478,"observar","v","to observe","en los que se pueden observar bajo microscopio",99,"3512","NA","NA","NA"
1268,"arrancar","v","to start (machine), uproot","abordó su auto, arrancó el motor diesel",97,"1106","NA","NA","NA"
863,"recién","adv","recently, just","amigos que recién habían tenido un hijo",98,"1793","NA","NA","NA"
970,"teoría","nf","theory","un artículo acerca de la fusión nuclear o la Teoría de la Relatividad",97,"3145","NA","NA","NA"
2059,"ocupación","nf","occupation, use","¿cual es tu ocupación actual? // Soy profesora",92,"591","NA","NA","NA"
155,"contar","v","to tell, count","me contó una larga y estúpida historia",100,"8534","NA","NA","NA"
2494,"combate","nm","combat, battle, fight","los Habsburgo españoles abandonaron el combate contra el turco",84,"730","NA","NA","NA"
816,"director","nm/f","director, manager, principal","ejerce este control el director de cada departamento",97,"2180","high","NA","NA"
1830,"casado","adj","married","soy un hombre casado y padre de familia",89,"860","high","NA","NA"
689,"constituir","v","to constitute, consist of","los miembros que pueden constituir un sector competitivo",97,"3992","NA","NA","NA"
230,"relación","nf","relationship, relation","he tenido una relación muy estrecha con los compositores",100,"6886","NA","NA","NA"
1710,"traje","nm","suit, dress, costume","vestido con mi traje marinero, la gorra en una mano",86,"1211","NA","NA","NA"
429,"importancia","nf","importance","¿qué proyectos de importancia tiene en su agenda?",100,"2956","NA","NA","NA"
1433,"estimar","v","to estimate, hold in esteem","el problema es el de estimar resultados válidos",95,"890","NA","NA","NA"
345,"ayudar","v","to help","espero ganar dinero para ayudar a mi pobre madre",100,"3482","NA","NA","NA"
909,"concreto","aj","concrete, real","de buscar una solución al problema concreto de las minas",99,"1767","NA","NA","NA"
1687,"muchacho","nm","boy","en aquella época yo era un muchacho de doce años",84,"2494","high","NA","low"
1596,"hábito","nm","habit","era un hábito que se repetía invariablemente en cada ocasión",95,"637","NA","NA","NA"
476,"gobierno","nm","government","el feudalismo fue la forma de gobierno",98,"6630","NA","NA","NA"
1415,"resistencia","nf","resistance, opposition","fue combatido por la resistencia popular",98,"1120","NA","NA","NA"
2408,"abuela","nf","grandmother","entonces la madre llora, y llora la abuela, y llora la nieta",76,"1373","NA","NA","low"
102,"sólo","adv","only, just","no siempre vestía ropa de mujer; sólo en carnaval",100,"19753","NA","NA","NA"
653,"título","nm","title, heading","esa novela tiene también otro título",100,"2072","NA","NA","NA"
219,"terminar","v","to finish, end","cuelga sin terminar la conversación",100,"6340","NA","NA","NA"
2291,"matiz","nm","shade, tint, nuance","no sólo blancas sino de matices de colores imprecisos",88,"431","NA","NA","NA"
438,"común","adj","common","el talento no es una cosa muy común",100,"3470","NA","NA","NA"
1330,"profundidad","nf","depth, profundity","tiene por lo menos, un metro de profundidad",98,"870","NA","NA","NA"
838,"corriente","nf","current, flow","la corriente eléctrica fluye por uno de los electrodos",100,"1656","NA","NA","NA"
2567,"antecedente","nm","antecedent","puede considerarse como un antecedente de las guías actuales",84,"461","NA","NA","NA"
1227,"figurar","v","to appear, represent, figure (in)","mi nombre no figuraba en ningún diccionario de autores",97,"847","NA","NA","NA"
1544,"procedimiento","nm","procedure, proceedings","hemos establecido un procedimiento para negociar",93,"1400","NA","NA","NA"
1876,"caro","adj","expensive, difficult, dear","trescientos pesos es muy caro..., mi marido no tiene dinero",91,"573","high","NA","NA"
2083,"duro","nm","duro (money)","estoy pensando poner un negocio y cobrar a diez duros la entrada ¿no?",87,"515","NA","NA","NA"
99,"nuevo","adj","new","marcaba el comienzo de una nueva vida para mí",100,"17381","NA","NA","NA"
1681,"agradecer","v","to thank for","le agradezco muchísimo su presencia aquí",87,"952","NA","NA","low"
960,"mejorar","v","to improve, get better","no va a mejorar, R. suspiró con aire de resignación",98,"1399","high","NA","NA"
396,"pronto","adv","soon, quick","pronto lo tuvieron todo hecho",100,"4791","NA","NA","NA"
1518,"concebir","v","to conceive, understand","concibió el plan para alcanzar su propósito",97,"726","NA","NA","NA"
1951,"mundial","adj","worldwide","París era el centro mundial de las bellas letras",90,"1511","NA","low","NA"
2564,"extrañar","v","to miss, long for","me iba a extrañar porque se había acostumbrado a mis visitas",86,"373","NA","NA","NA"
2050,"fantasía","nf","fantasy, fancy","empieza a confundir la fantasía con la realidad",89,"731","NA","NA","NA"
1508,"paisaje","nm","landscape","un paisaje extraño: una montaña, un río y árboles con flores",92,"1104","NA","NA","NA"
1117,"fundar","v","to found, base","su intención de fundar una colonia penitenciaria",97,"1554","NA","NA","NA"
465,"público","adj","public","el 4 de marzo da su último concierto público",99,"5459","NA","NA","NA"
650,"aplicar","v","to apply","lo amarró a un árbol y le aplicó una feroz paliza",100,"2249","NA","NA","NA"
2235,"criatura","nf","creature, child","¿cómo iba a andar esa criatura sin papá?",85,"728","NA","NA","NA"
4,"y","conj","and","él y ella sabían leer y escribir",100,"562162","NA","NA","NA"
2113,"ruta","nf","route","cada cual tomó su ruta y llegó al destino",90,"691","NA","NA","NA"
507,"nacional","adj","national","le dieron el premio nacional de poesía",99,"4894","NA","NA","NA"
112,"volver","v","to return, to V again","los habitantes afectados puedan volver a sus casas",100,"15275","NA","NA","NA"
994,"seguramente","adv","surely, securely","se sentó a mi lado, seguramente para darme confianza",96,"1523","high","NA","NA"
2520,"eh","interj","eh","te interesa la palabra, ¿eh?",67,"15797","high","NA","low"
2529,"armonía","nf","harmony","el busca su armonía espiritual en la naturaleza",87,"485","NA","NA","NA"
1918,"elegante","adj","elegant, smart, stylish","una casa muy elegante, rodeada de un gran parque",91,"667","NA","NA","NA"
951,"esposa","nf","wife","la delicada solicitud de Elena, su esposa y compañera permanente",96,"1523","NA","NA","NA"
1591,"progreso","nm","progress","está haciendo un gran progreso en la lucha contra el narcotráfico",95,"907","NA","NA","NA"
440,"próximo","adj","next","pasará el próximo semestre enseñando literatura",100,"3279","NA","NA","NA"
262,"amigo","nm","friend","¿No tienes un amigo a quien me podrías presentar?",99,"6059","NA","NA","NA"
714,"éxito","nm","success","tiene mucho éxito con sus piezas teatrales",100,"2257","NA","NA","NA"
1548,"informe","nm","report","ya he leído el informe escrito",93,"1149","NA","NA","NA"
817,"retirar","v","to take away, retire","retiró su nombre de la contienda por la presidencia",98,"1647","NA","NA","NA"
1683,"sesión","nf","session, meeting","he convocado esta sesión extraordinaria para estudiar el problema",93,"727","NA","NA","NA"
469,"lejos","adv","far (away, off)","ese sitio estaba lejos del pueblo",100,"3024","NA","NA","NA"
772,"calidad","nf","quality","para mejorar la calidad de vida de los mexicanos",99,"1970","NA","NA","NA"
567,"arte","nm","art, skill","la creación de un museo de arte moderno y contemporáneo",99,"3581","NA","NA","NA"
1631,"negativo","adj","negative, pessimistic","otro aspecto negativo es la libertad controlada",94,"834","NA","NA","NA"
519,"presencia","nf","presence, appearance","un ruido que advirtió a los ladrones de su presencia en la casa",100,"3014","NA","NA","NA"
703,"noticia","nf","news","¿qué noticias tienen de la isla de Mallorca?",99,"2093","NA","NA","NA"
962,"emplear","v","to employ","el pintor necesita emplear sus talentos en sus obras",98,"1749","NA","NA","NA"
330,"nacer","v","to be born","Picasso nació en Málaga en 1881",100,"3914","NA","NA","NA"
1328,"activo","adj","active","hubo un activo ir y venir de hombres",95,"1433","NA","NA","NA"
518,"asunto","nm","matter, issue, affair","se ha creado una gran polémica sobre el asunto",98,"3064","NA","NA","NA"
749,"fecha","nf","date, day","lo celebro inmortalizando esta fecha en mi diario",100,"1767","NA","NA","NA"
873,"comida","nf","food, meal","en los restaurantes no se servía comida antes de las ocho",97,"1739","NA","NA","NA"
626,"costar","v","to cost, be hard","la pensión les costaba más o menos seis mil pesos",99,"2039","NA","NA","NA"
1452,"experto","nm","expert","pronto se convirtió en un experto en armas y explosivos",94,"888","NA","NA","NA"
2062,"compuesto","adj","composite, mixed","ambas entidades, protón y neutrón, están compuestas de quarks",89,"937","NA","NA","NA"
647,"entrada","nf","entrance, admission ticket","llegamos nada más que hasta la entrada de la casa",100,"1743","NA","NA","NA"
194,"agua","nf (el)","water","Déme usted un vaso de agua, que tengo mucha sed",100,"8456","NA","NA","NA"
467,"programa","nm","program, plan","van a aprender mucho de este programa escolar",99,"4161","high","NA","NA"
533,"rojo","adj","red","su boca, muy roja, apenas se movió",100,"3121","NA","NA","NA"
2084,"adentro","adv","inside","allí adentro estaba uno de los salones de té",85,"1154","NA","NA","low"
2216,"válido","adj","valid","una iniciativa válida, meditada, y bien hecha",89,"535","NA","low","NA"
1670,"concentración","nf","concentration, gathering","la visita de Leah no perturbó en absoluto mi concentración",96,"920","NA","NA","NA"
2175,"explosión","nf","explosion","una explosión de gas hizo saltar los vidrios",88,"560","NA","NA","NA"
1562,"bomba","nf","bomb, explosion, pump","con el lanzamiento de la primera bomba atómica sobre Hiroshima",94,"822","NA","NA","NA"
2407,"oreja","nf","ear","aprendí a escuchar, a abrir mis orejas como flores",82,"877","NA","NA","NA"
1074,"inmenso","adj","immense, vast, huge","busqué esconderme entre unas inmensas rocas",99,"1359","NA","NA","NA"
100,"encontrar","v","to find","encontró un lugar apropiado para instalar la sucursal",100,"15556","NA","NA","NA"
2521,"eje","nm","axis, shaft, crux","atraviesan el eje de rotación de la Tierra",85,"602","NA","NA","NA"
992,"hogar","nm","home, hearth","el niño tiene derecho a un hogar y a un padre, a un apellido",100,"1192","NA","NA","NA"
1662,"desconocer","v","to not know, not recognize","todavía se desconoce la identidad del cuerpo",96,"657","NA","NA","NA"
896,"mediante","prep","by means of","se salvó mediante el remedio ése",98,"2678","NA","NA","NA"
372,"levantar","v","to raise, lift","de pronto se levantó y fue hasta su biblioteca",100,"4984","NA","NA","NA"
339,"centro","nm","center, middle, downtown","no necesitan estar solos en el centro del escenario",100,"4332","NA","NA","NA"
295,"campo","nm","field, country","mi campo principal es la enfermedad coronaria",100,"5280","NA","NA","NA"
2311,"veinticinco","num","twenty-five","¡Veinticinco años y no sabe lo que es el amor!",85,"515","high","NA","low"
412,"bajo","adj","short, low","las puertas de madera son bajas y rudas",100,"3245","NA","NA","NA"
2425,"ganado","nm","livestock, cattle","es más económico criar y engordar el ganado en la Argentina",86,"486","NA","NA","NA"
2219,"delito","nm","crime, offense","se está acusando a mi clienta de un delito muy grave",84,"834","high","NA","NA"
278,"madre","nf","mother","ahora está casada, es madre de familia",100,"7522","NA","NA","NA"
552,"crecer","v","to grow, increase","nació y creció el muchacho en La Huerta",99,"2911","NA","NA","NA"
2310,"fase","nf","phase, stage","la primera fase de la lucha finalizó en junio",84,"1185","NA","low","NA"
1267,"adoptar","v","to adopt","¿estaría con tiempo de adoptar otra postura?",97,"1584","NA","NA","NA"
150,"mano","nf","hand","se pueden contar con los dedos de una mano",100,"13309","NA","NA","NA"
2260,"ala","nf (el)","wing, flank","a este pájaro habrá que cortarle las alas",84,"853","NA","NA","NA"
1602,"área","nf (el)","area, zone","encerrando un área circular de unos treinta metros de diámetro",90,"2327","high","low","NA"
2154,"etcétera","n","etcetera","aproveché para comprar hierba, azúcar, whisky, etcétera, en el almacén",80,"1363","high","low","NA"
1523,"naturalmente","adv","naturally","los paraguayos somos naturalmente músicos",89,"1206","high","NA","NA"
2080,"doloroso","adj","painful","como parecía ser un tema doloroso para él, no le pregunté nunca",88,"522","NA","NA","NA"
490,"detener","v","to stop, detain","su pupila se detenía sobre el papel",100,"3559","NA","NA","NA"
946,"energía","nf","energy, power","no encontró ni las palabras ni la energía para hacerlo",98,"2641","NA","NA","NA"
496,"principal","adj","main, principal","¿cuál es el problema principal?",100,"4056","NA","NA","NA"
1313,"aparte","adv","apart, aside, separately","no pertenezco a nadie aparte de mi propia realidad",97,"810","high","NA","NA"
186,"cambio","nm","change","podía requerir un cambio de actitud",100,"8059","NA","NA","NA"
524,"enseñar","v","to teach, show","¿qué objeto tiene enseñar química en Secundaria?",100,"2384","high","NA","NA"
1891,"nación","nf","nation","la entrada de nuestro país en el grupo de naciones europeas",89,"1610","NA","NA","NA"
350,"edad","nf","age","se acercaba a la edad de encontrar un hombre con quien casarse",100,"3870","NA","NA","NA"
1700,"patio","nm","courtyard, playground, yard","en el centro del patio hay un árbol y a sus lados unos asientos de piedra",88,"1653","NA","NA","NA"
1408,"fabricar","v","to manufacture","contrató a gente para fabricar y vender el producto",94,"890","NA","NA","NA"
421,"dónde","adv","where?","¿Dónde está escrito esto en la historia?",98,"4145","high","NA","NA"
2477,"paralelo","adj","parallel","donde las líneas paralelas se representan como convergentes",86,"476","NA","NA","NA"
2437,"templo","nm","temple, church","el saqueo de Jerusalén y la destrucción del Templo en el año 68",81,"768","NA","NA","NA"
2039,"oculto","adj","hidden, occult","muy esotérico; como ciencias ocultas",90,"659","NA","NA","NA"
2261,"debate","nm","debate","se ha agudizado el debate sobre la efectividad de las investigaciones",83,"1441","high","low","NA"
2246,"cariño","nm","love, affection","un santo cuya vida simboliza el amor, el cariño y la generosidad",82,"695","high","NA","low"
220,"permitir","v","to allow, permit","no se me permitió jugar allí por varios días",100,"7481","NA","NA","NA"
1827,"aplicado","adj","applied","la distinción entre ciencia básica y aplicada no existe",94,"608","NA","NA","NA"
52,"yo","pron","I (subj)","¡Yo soy el padre!",98,"54635","high","NA","NA"
1875,"impulsar","v","to push, promote, drive","se incorpora para impulsar la canoa apoyándose en las vigas",93,"742","NA","NA","NA"
1012,"intento","nm","attempt, try","al segundo intento tampoco pudo",100,"1315","NA","NA","NA"
1505,"apartar","v","to move away, separate","se apartó del rebaño para seguir su propio camino",95,"1138","NA","NA","NA"
64,"ni","conj","not even, neither, nor","pero ni eso me tranquilizó",100,"24261","NA","NA","NA"
2241,"madrugada","nf","dawn, daybreak","estudiaron toda la noche hasta la madrugada",84,"780","NA","NA","NA"
853,"nota","nf","note, grade","la «españolada» tiene siempre una nota de carácter despectivo",98,"1702","NA","NA","NA"
2292,"impresionar","v","to impress","a mí no me impresionó tanto la escena de la crucifixión",88,"458","NA","NA","NA"
2613,"conservador","adj","conservative","yo antes era liberal y me he convertido en conservador",82,"832","NA","low","NA"
362,"movimiento","nm","movement","estaba encabezando un movimiento de subversión",100,"5542","NA","NA","NA"
2233,"tristeza","nf","sadness","las víctimas se sumergen en una tristeza infinita",86,"850","NA","NA","NA"
1253,"comercial","adj","commercial, shopping","está empleado en una firma comercial importante",94,"1773","NA","NA","NA"
2127,"década","nf","decade","el láser fue desarrollado en las décadas de 1950 y 1960",84,"2819","NA","low","NA"
2324,"deshacer","v","to undo, destroy, take apart","cuesta mucho deshacer una decisión mal tomada",89,"516","NA","NA","NA"
58,"entre","prep","between, among","la cosa es entre tú y yo",100,"30756","NA","NA","NA"
1866,"limitado","adj","limited","tienen aplicaciones limitadas, debido a su pobre resistencia",94,"760","NA","NA","NA"
2403,"inaugurar","v","to inaugurate, start","llegó el momento de inaugurar la nueva iglesia",89,"382","NA","NA","NA"
1855,"poema","nm","poem","le escribe un poema diario a su novia",85,"1099","NA","NA","NA"
1805,"suficientemente","adv","enough","no eran suficientemente cómodos para ella",94,"555","NA","NA","NA"
750,"participar","v","to participate","me quería meter en eso, participar y trabajar en todo eso",98,"2385","NA","NA","NA"
97,"seguir","v","to follow, keep on","el calor sofocante que sigue al mediodía",100,"16104","NA","NA","NA"
318,"fondo","nm","bottom, end","ese es el sistema, y en el fondo funciona",100,"4752","NA","NA","NA"
304,"semana","nf","week","no todos los días, pero varios días de la semana",100,"3960","NA","NA","NA"
2008,"desnudo","adj","nude, naked","dibujaba la silueta del cuerpo desnudo",86,"1316","NA","NA","NA"
2158,"posesión","nf","possession","están en posesión de armas ilegales",90,"625","NA","NA","NA"
