"rank","headword","pos","english","sample","range","rawFreq","oral","fiction","nonFiction"
2543,"oración","nf","prayer","rezando la oración milagrosa con que impetraba piedad a la Virgen",80,"549","NA","NA","NA"
893,"verano","nm","summer","esperan el calor del verano que cada día parecía más lejano",97,"1608","NA","NA","NA"
702,"paz","nf","peace","de inmediato que se siente en un ambiente de paz y armonía",99,"2335","NA","NA","NA"
550,"música","nf","music","la gente se detenía siempre a escuchar la música que tocaban",97,"4350","NA","NA","NA"
1048,"analizar","v","to analyze","no tenía tiempo de analizar sus actos",99,"1458","NA","NA","NA"
1310,"soportar","v","to endure, stand (something)","ya no puedo soportar estos disgustos",96,"1164","NA","NA","NA"
1327,"sugerir","v","to suggest, hint at","su intención era sugerir unas ideas",97,"947","NA","NA","NA"
642,"obligar","v","to obligate, force","me obligó a terminar una novela",100,"2164","NA","NA","NA"
534,"tras","prep","after, behind","A. había retornado a su tierra tras años de lucha",97,"5106","NA","NA","NA"
1996,"captar","v","to capture, attract","como si quisiera captar y retener los latidos del corazón",91,"544","NA","NA","NA"
645,"mar","nmf","sea","sobre todo en la región costera del mar Rojo",97,"3385","NA","NA","NA"
887,"advertir","v","to notice, warn","una compañera le advirtió que aquello era una falsificación",98,"2118","NA","NA","NA"
135,"lugar","nm","place, position","es el lugar más lindo de la costa",100,"11214","NA","NA","NA"
1993,"revés","nm","al revés: backwards, upside down, inside out","¿qué le parece si hacemos las cosas al revés?",90,"544","high","NA","NA"
829,"contener","v","to contain","una dieta que no contiene las cosas que te llevan a la obesidad",96,"2367","NA","NA","NA"
2398,"generoso","adj","generous","se ve generoso porque le da más que recibe",84,"546","NA","NA","NA"
1228,"terrible","adj","terrible","me daba miedo hablar de algo tan terrible como la guerra",94,"1387","NA","NA","NA"
759,"tirar","v","to throw, pull","el público se puso furioso y nos tiró tomates",97,"2440","NA","NA","NA"
2146,"gloria","nf","glory, fame","un gran compositor obtiene la gloria en vida",85,"673","NA","NA","NA"
1444,"chino","adj","Chinese","una escaramuza entre las tropas japonesas y chinas",94,"1286","NA","NA","NA"
269,"usted","pron","you (subj/–fam)","los tiene usted, señor alcalde",89,"19531","high","NA","low"
2313,"remoto","adj","remote, far-off","fui confinado a un remoto curato de la campaña",88,"606","NA","NA","NA"
1570,"firme","adj","firm, steady","tenemos la firme convicción de reconocer errores",97,"932","NA","NA","NA"
1713,"playa","nf","beach, seaside","estamos sentados en la playa y a lo lejos van pasando los barcos",89,"963","NA","NA","NA"
2345,"garantizar","v","to guarantee","el nuevo gobierno garantiza su seguridad personal",87,"807","NA","NA","NA"
456,"responder","v","to answer, respond","el Gobierno respondió por escrito a este diputado",99,"3270","NA","NA","NA"
920,"coincidir","v","to coincide, agree","se entienden, a pesar de no coincidir siempre en sus opiniones",99,"1268","NA","NA","NA"
1221,"concluir","v","to conclude, finish","no tuvo tiempo de concluir su propio pensamiento",95,"1336","NA","NA","NA"
457,"sufrir","v","to suffer, undergo","sufrió la eterna tragedia del grande",100,"3220","NA","NA","NA"
1553,"pico","nm","y pico: and a bit; beak, peak","a través de estos cuarenta y pico años",96,"661","NA","NA","NA"
2375,"quebrar","v","to break, bend, weaken","la voz de la autoridad quebró el silencio: -¡Alto!",87,"453","NA","NA","NA"
408,"sociedad","nf","society","creaban una sociedad multicultural que vivía en paz",100,"5484","NA","NA","NA"
2354,"doble","nm","double","se gastará el doble de lo que se tiene que gastar",88,"410","NA","NA","NA"
610,"curso","nm","course, direction","después hice el curso de literatura contemporánea",99,"2485","high","NA","NA"
797,"piso","nm","floor, story","había una escalera hasta el tercer piso",97,"1925","NA","NA","NA"
2016,"herencia","nf","inheritance, legacy","ese carácter era una herencia de su bisabuela nórdica",92,"583","NA","NA","NA"
1116,"someter","v","to subject","te vamos a someter a una prueba de resistencia",98,"1585","NA","NA","NA"
1651,"típico","adj","typical","una de esas típicas leyendas chilenas",94,"829","NA","NA","NA"
680,"cerrado","adj","closed","las cámaras de TV de circuito cerrado",100,"1626","NA","NA","NA"
1176,"reflejar","v","to reflect","los términos se debían modificar para reflejar los cambios",98,"1348","NA","NA","NA"
2229,"amenaza","nf","threat","me acostumbraron a obedecer bajo la amenaza de terribles castigos",88,"829","NA","NA","NA"
206,"obra","nf","work, book, deed","la primera obra literaria de Dante fue La Vida Nueva",100,"7601","NA","NA","NA"
280,"social","adj","social","no me gusta la vida social, no voy a ninguna parte",100,"8196","high","NA","NA"
554,"tú","pron","you (subj-sg/+fam)","¡qué clase de hombre eres tú!",90,"9403","high","NA","low"
1532,"vacío","adj","empty, vacant","tarea cumplida, noche vacía",93,"1169","NA","NA","NA"
881,"banco","nm","(financial) bank, bench","el Banco de México garantiza una parte del crédito",97,"1681","NA","NA","NA"
867,"sentimiento","nm","feeling, sentiment","se molesta, hay en ella un sentimiento de frustración",99,"1913","NA","NA","NA"
1276,"atrever","v","to dare","esperó resignado, sin atreverse a salir",92,"1383","NA","NA","NA"
623,"futuro","nm","future","en la actualidad, y más aún en el futuro",100,"2193","NA","NA","NA"
1699,"oposición","nf","opposition","abogaba por una ceremonia simple, en oposición a la Iglesia católica",91,"1545","NA","NA","NA"
2123,"asociación","nf","association","pertenezco a una asociación o a una cofradía",89,"788","NA","low","NA"
2036,"formal","adj","formal, polite","que se construyera una sala formal para las visitas",90,"766","NA","NA","NA"
894,"respeto","nm","respect, regard","hasta ese momento sentía un respeto muy grande hacia él",99,"1650","NA","NA","NA"
2072,"inspirar","v","to inspire, inhale","era capaz de inspirar y alentar una ambición de grandeza",89,"821","NA","NA","NA"
1901,"elemental","adj","elemental, basic","nada más que el material escolar, que era muy elemental.",93,"617","NA","NA","NA"
380,"usar","v","to use","mi teléfono no funciona y quisiera usar el tuyo",100,"3537","NA","NA","NA"
615,"duro","adj","hard","reflejaba la dura realidad de la posguerra italiana",99,"2126","NA","NA","NA"
2266,"vendedor","nm/f","salesperson","es el vendedor de pescado que va de casa en casa",85,"511","NA","NA","NA"
2353,"equivocado","adj","mistaken, wrong","usted estaba equivocado; pensaba en tal cosa y era esta otra",89,"434","NA","NA","NA"
1809,"alterar","v","to alter, modify","no tenemos derecho a alterar el plan del Creador",94,"679","NA","NA","NA"
1586,"amarillo","adj","yellow","los colores cálidos (rojo, amarillo y anaranjado)",92,"1245","NA","NA","NA"
1744,"saludar","v","to greet, say hello","«Buenas noches», saludó E.",89,"1213","NA","NA","NA"
1386,"techo","nm","roof","es una casa clásica campesina, con techo de tejas",96,"1141","NA","NA","NA"
1153,"breve","adj","brief, short","les ruego que no pronuncien discursos, por breves que sean",99,"1323","NA","NA","NA"
770,"pesar","v","to weigh","el diamante pesaba sin cortar 60,25 quilates",100,"2082","NA","NA","NA"
1973,"mecánico","adj","mechanical","fue un acto mecánico y repetido",92,"550","NA","NA","NA"
1290,"justicia","nf","justice, fairness","el castigo es cosa de la justicia",94,"1314","NA","NA","NA"
175,"largo","adj","long","tenía el pelo largo a la altura de los pechos",100,"8397","NA","NA","NA"
1077,"citar","v","to cite, quote","sabe lo que dice; citó datos y fuentes",97,"1317","NA","NA","NA"
50,"alguno","adj","some, someone (pron)","habló algunas palabras con el agente de negocios",100,"30485","NA","NA","NA"
1057,"destinar","v","to assign, appoint","me ocuparé de destinar un lugar para pensar",99,"1246","NA","NA","NA"
1881,"dictar","v","to dictate, announce","la imparcialidad del tribunal sabrá dictar el veredicto más justo",96,"567","NA","NA","NA"
1307,"silla","nf","chair, seat","me senté en una silla baja junto al fuego",95,"1478","NA","NA","NA"
494,"elegir","v","to choose, elect","los caminos son muchos y hay que elegir el mejor",100,"2853","NA","NA","NA"
1007,"causar","v","to cause, bring about","el fuego causó severos daños en el área",98,"1362","NA","NA","NA"
31,"otro","adj","other, another","¿por qué no podía ser otra cosa?",100,"61726","NA","NA","NA"
1656,"crítico","adj","critical","sus observaciones críticas podían llegar a ser cáusticas",95,"889","NA","NA","NA"
2225,"ciclo","nm","cycle","ahora, todo el ciclo iba a comenzar de nuevo",88,"919","NA","NA","NA"
2201,"voto","nm","vote","estableció el voto universal, directo y secreto para todos",80,"1710","high","NA","NA"
1156,"conformar","v","to conform","O. no se conformó fácilmente con la ausencia de L.",98,"904","NA","NA","NA"
1185,"cama","nf","bed (furniture)","no podía dormir en esa cama pequeña",90,"2973","NA","NA","NA"
249,"presentar","v","to introduce, present","P. me presentó con gravedad a una chica virgen",100,"6406","NA","NA","NA"
617,"negar","v","to deny, refuse","no puedo negar esta evidencia",99,"2316","NA","NA","NA"
2536,"protagonista","nc","protagonist, main character","era la cruel protagonista de su propia historia",82,"637","NA","NA","NA"
2343,"mínimo","nm","minimum","la educación no está dando el mínimo de conocimientos que se supone",91,"425","NA","NA","NA"
846,"cuidar","v","to take care of","debía cuidar la virginidad de la hija",99,"1463","NA","NA","NA"
2096,"orilla","nf","shore, edge","fue a pasar sus vacaciones a la orilla del mar",89,"797","NA","NA","NA"
2467,"mito","nm","myth","el mito es una explicación imaginativa y fantástica del hombre",83,"770","NA","NA","NA"
1941,"suelto","adj","loose","se me cayó el diente suelto",89,"715","NA","NA","NA"
1636,"postura","nf","posture, position, attitude","parecía preocupado y trataba de adoptar una postura natural",92,"945","NA","NA","NA"
1182,"rechazar","v","to reject","es libre para aceptar o rechazar la propuesta",97,"1334","NA","NA","NA"
1678,"perdonar","v","to forgive, excuse","«Perdone que le despierte», Doctor",86,"1094","high","NA","low"
835,"informar","v","to inform","pero alguien le informó que ya se había ido",98,"1530","NA","NA","NA"
1817,"amiga","nf","friend (f)","había venido al hospital a visitar a una amiga enferma",82,"1464","high","NA","low"
1637,"salón","nm","hall, room","en el salón social hay eventos culturales, hay asambleas",89,"1137","NA","NA","NA"
1139,"escena","nf","scene, stage, setting","aparece en la escena artística en 1960",96,"1479","NA","NA","NA"
1985,"pasear","v","to go for a walk, ride","me gustaba pasear por ese lugar abierto",84,"988","NA","NA","NA"
2418,"contratar","v","to hire, contract","tuvo que contratar a otra empleada",89,"376","NA","NA","NA"
2286,"mamá","nf","mom","la casa es de mamá y ella prácticamente mantenía la casa",71,"2743","high","NA","low"
26,"o","conj","or","sí esperaba uno o dos muertos",100,"82444","NA","NA","NA"
2608,"sal","nf","salt","le echo la sal, ajo, cebolla, pimienta, y el orégano",82,"483","NA","NA","NA"
1368,"complicado","adj","complicated, complex","algo más se presentía, más hondo y complicado",99,"746","NA","NA","NA"
359,"color","nm","color","coincide con los colores primarios: rojo, azul y amarillo",100,"4156","NA","NA","NA"
1252,"dudar","v","to (have) doubt","yo dudo de que el Gobierno tenga la capacidad",97,"991","NA","NA","NA"
2623,"preferencia","nf","preference","yo tenía preferencia por los criminales y no por las víctimas",86,"396","NA","NA","NA"
2303,"moreno","adj","dark, brown","ni rubio ni moreno, ni tan alto ni tan bajo",85,"486","NA","NA","NA"
226,"servir","v","to serve","destapa la botella y sirve unas copas",100,"5438","NA","NA","NA"
33,"la","pron","[3rd person] (dir obj-f)","la puso en su bolsillo",100,"55523","NA","NA","NA"
1197,"mirada","nf","gaze, look","refleja una mirada límpida, inocente y sorprendida",91,"3054","NA","NA","NA"
20,"lo","art","the (+ n)","lo mejor es estudiar mucho",100,"91035","NA","NA","NA"
1178,"seco","adj","dry, arid","el río está seco y no circula",93,"1615","NA","NA","NA"
1099,"oficial","adj","official, authorized","el guaraní es el idioma oficial de Paraguay",98,"1708","NA","NA","NA"
2557,"adiós","nm","goodbye","¡Adiós, hasta luego, Marisa!",79,"584","NA","NA","NA"
544,"arriba","adv","up, above","desde arriba yo veía a mis dos hijas",98,"2574","NA","NA","NA"
532,"escuela","nf","school","dicta clases en la Escuela de Medicina de esa Universidad",100,"3098","NA","NA","NA"
272,"gracia","nf","(pl) thank you; grace, favor","bueno, gracias por tu tiempo, ¿eh?",99,"5477","high","NA","NA"
401,"mañana","nf","morning, tomorrow","sí, todo el día está allá, desde la mañana hasta la tarde",98,"4513","high","NA","NA"
2463,"poquito","adj","little bit","precisamente a la diez o un poquito más tarde",75,"1184","high","NA","low"
1137,"frecuencia","nf","frequency","se ha citado con mucha frecuencia en varias ocasiones",97,"1583","NA","NA","NA"
92,"hablar","v","to speak, talk","algunos hablan el idioma romaní",100,"19006","high","NA","NA"
2058,"organizado","adj","organized","es un estudiante disciplinado y organizado",92,"714","NA","NA","NA"
1616,"llegada","nf","arrival","para celebrar el V Centenario de la llegada de Colón a América",94,"949","NA","NA","NA"
879,"exacto","adj","exact, faithful, true","en ese momento, en ese exacto momento, no antes ni después",100,"1187","NA","NA","NA"
818,"explicación","nf","explanation","el mito es una explicación imaginativa del mundo y del hombre",100,"1464","NA","NA","NA"
1085,"crisis","nf","crisis","después tuvo un ataque de ansiedad, pero la crisis no fue tan severa",96,"2222","NA","NA","NA"
1507,"reclamar","v","to demand, require","«Por favor, déme diez relojes», reclama una mujer",94,"900","NA","NA","NA"
1456,"listo","aj","ready, clever, smart","en la mesa estaba listo mi desayuno",93,"773","high","NA","NA"
973,"salud","nf","health","ayudan a elevar el nivel de salud a través de la alimentación",98,"1582","NA","NA","NA"
1706,"confusión","nf","confusion","la confusión y el desorden eran los síntomas característicos",97,"566","NA","NA","NA"
700,"costumbre","nf","habit, custom, usage","tampoco faltaban, como era costumbre, las faltas de respeto",99,"2028","NA","NA","NA"
1468,"interpretación","nf","interpretation, interpreting","de desarrollar su propia interpretación sobre lo que habían estudiado",96,"1103","NA","NA","NA"
2436,"partidario","nm","supporter, partisan","yo no soy partidario de los noviazgos largos",87,"620","NA","NA","NA"
1302,"desconocido","adj","unknown","salí sin mapa con rumbo desconocido",98,"1210","NA","NA","NA"
1751,"enseñanza","nf","teaching, instruction","dedicó su vida a la enseñanza y dirección de su colegio",90,"1194","high","low","NA"
1740,"abuelo","nm","grandfather","entonces sería, pues, mi abuelo, mi papá y mi hermano",85,"1515","NA","NA","low"
593,"gusto","nm","pleasure, taste, preference","mi personal gusto artístico no es nada conservador",99,"2056","NA","NA","NA"
32,"ese","adj","that (m) [esa (f)]","¿dónde viven esas mujeres?",100,"60989","high","NA","NA"
547,"suficiente","adj","sufficient, enough","no tuvo el tiempo suficiente para ejecutar sus proyectos",100,"2407","NA","NA","NA"
241,"pueblo","nm","people, village","el libro no representa al pueblo portugués",99,"7138","NA","NA","NA"
1965,"peor","adj","worse, worst","ese desastre era el peor del año",90,"590","NA","NA","NA"
2021,"bandera","nf","flag","la bandera de la región está compuesta por tres franjas horizontales",90,"679","NA","NA","NA"
2148,"noviembre","nm","November","la época de primavera y verano, o sea, desde el mes de noviembre a marzo",87,"944","NA","NA","NA"
1482,"individual","adj","individual","su misión era solitaria, su problema individual",94,"1249","NA","NA","NA"
813,"instrumento","nm","instrument","el músico probó su instrumento disparando algunas notas",100,"1721","NA","NA","NA"
924,"salvo","adv","except (for), but","todo ha envejecido salvo esa mirada",99,"1223","NA","NA","NA"
981,"debido","adj","debido a: due to","una infección intestinal, debido a la falta de higiene",96,"2056","NA","NA","NA"
1992,"división","nf","division","es un criterio de especialización y de división del trabajo",90,"963","high","low","NA"
1810,"lector","nm","reader, lecturer","no me interesa como lector ese tipo de literatura",87,"1199","NA","NA","NA"
1550,"cliente","nc","client, customer","hablábamos de los negocios, de los clientes, y de las ventas",90,"859","NA","NA","NA"
1401,"disciplina","nf","discipline, subject","imponía la disciplina escolar",97,"933","NA","NA","NA"
2426,"pez","nm","(alive) fish","en las costas de Maine, pescaban el pez espada",83,"694","NA","NA","NA"
1808,"filosofía","nf","philosophy","«De todos modos tenemos que morir» era la filosofía del hombre",92,"1213","NA","NA","NA"
1590,"padecer","v","to suffer","un riesgo elevado de padecer enfermedades coronarias",93,"813","NA","NA","NA"
1846,"arrojar","v","to throw, fling","arrojó el vaso de mezcal al piso",93,"945","NA","NA","NA"
2483,"viernes","nm","Friday","trabajé toda la semana y el viernes cambié un mísero cheque en el banco",79,"641","high","NA","low"
625,"mitad","nf","half, middle","es un libro sobre la primera mitad del siglo",100,"2159","NA","NA","NA"
45,"mucho","adj","much, many, a lot (adv)","por lo visto tienen mucho dinero",100,"36391","high","NA","NA"
425,"partido","nm","party, group, (sports) match","fue consejero de un candidato del partido conservador",98,"7030","high","NA","NA"
1516,"local","adj","local","cuando podíamos rivalizar con la producción local",94,"1527","NA","NA","NA"
656,"material","nm","material, element","la aplicación de los materiales superconductores de alta temperatura",100,"2174","NA","NA","NA"
1379,"remedio","nm","alternative, cure, solution","al final no tuvieron más remedio que ceder",94,"938","NA","NA","NA"
1799,"crédito","nm","credit, reputation","pero se le puede pagar con la tarjeta de crédito",92,"1128","NA","NA","NA"
925,"llenar","v","to fill","un espacio se puede llenar con muchos elementos bonitos",98,"1793","NA","NA","NA"
1224,"hermoso","adj","beautiful, lovely","ese pájaro se caracteriza por su sonido muy hermoso",93,"1834","NA","NA","NA"
2560,"tabaco","nm","tobacco, cigarette, cigar","suelo fumar mi pipa con tabaco barato",77,"610","NA","NA","NA"
1537,"limpiar","v","to clean","le limpian los labios con las servilletas",94,"761","NA","NA","NA"
1738,"aportar","v","to provide, contribute","ellos son los que quieren aportar recursos",91,"974","high","NA","NA"
61,"desde","prep","from, since","lo había pensado desde el primer momento",100,"25288","NA","NA","NA"
1902,"crecimiento","nm","growth, increase","ha experimentado el crecimiento más rápido en Europa",89,"1975","NA","NA","NA"
275,"malo","adj","bad","éste se lamentó de su mala suerte",100,"5025","NA","NA","NA"
1815,"campesino","adj","rural","la dramática situación de las familias mineras y campesinas",89,"1284","NA","NA","NA"
2189,"terror","nm","terror, horror","sufren del terror a la muerte y a la soledad",86,"652","NA","NA","NA"
1031,"carga","nf","load, charge, cargo","muchos cuadros tienen mucha carga emocional en sus imágenes",97,"1461","NA","NA","NA"
2509,"lamentar","v","to regret","lamentaba la muerte de mi gran amigo",83,"531","NA","NA","low"
2131,"atractivo","adj","attractive","haciendo más interesantes sus clases, más atractivas, más vivas",93,"424","NA","NA","NA"
1928,"infancia","nf","infancy, childhood","prefiero no hablar de mi infancia ni de los años de orfandad",90,"797","NA","NA","NA"
728,"finalmente","adv","finally, at last","la casa fue finalmente demolida",98,"2136","NA","NA","NA"
1730,"espejo","nm","mirror, reflection","vio al mozo aquel reflejado en el espejo del ropero",89,"1475","NA","NA","NA"
1847,"precisión","nf","precision","no recuerdo con precisión cuánto duró aquel programa",94,"702","NA","NA","NA"
37,"ver","v","to see","había que subir para ver las ruinas",100,"45854","high","NA","NA"
2379,"sucesivo","adj","successive, following","podría ser; en forma sucesiva; sucede mucho",88,"617","NA","NA","NA"
308,"interés","nm","interest","usted, de verdad, sí tiene interés en este tema",100,"5016","NA","NA","NA"
1598,"artístico","adj","artistic","París se convirtió en el centro artístico de Europa",92,"1253","NA","NA","NA"
2368,"variedad","nf","variety","se podía sembrar y cosechar gran copia y variedad de frutos",86,"996","NA","NA","NA"
1856,"avanzado","adj","advanced","tenía el solicitante un cáncer muy avanzado",92,"631","NA","NA","NA"
2283,"considerable","adj","considerable","era una mujer de considerable posición social",87,"574","NA","NA","NA"
2224,"otorgar","v","to give, grant, award","su jefe le prometió otorgar un aumento salarial",90,"797","NA","NA","NA"
608,"inglés","adj","English","y no tardó en dominar la lengua inglesa",96,"2989","NA","NA","NA"
1490,"fruto","nm","fruit, result","este fármaco es fruto de dieciocho años de trabajo",96,"831","NA","NA","NA"
918,"unir","v","to unite, join (together)","lo que Dios ha unido no lo separe el hombre",98,"1720","NA","NA","NA"
663,"provocar","v","to cause, provoke","la brisa provoca una blanca lluvia de flores",100,"2873","NA","NA","NA"
1952,"mueble","nm","(piece of) furniture","puro mueble roto, sillas sin sus patas",87,"802","NA","NA","NA"
1977,"lección","nf","lesson","le enseñaba una lección de cómo vivir y cómo sobrevivir",89,"562","NA","NA","NA"
2145,"té","nm","tea","un código de salud que les prohibe consumir té, café, alcohol y tabaco",83,"666","NA","NA","NA"
1538,"vacío","nm","emptiness, void","el salto en el vacío, es generalmente un salto hacia la muerte",95,"940","NA","NA","NA"
2381,"feo","adj","ugly, nasty, rude","sólo hombres feos y mujeres atractivas",81,"681","NA","NA","low"
123,"cierto","adj","certain, sure, true","no sé si esto es cierto o no",100,"12363","NA","NA","NA"
1080,"novela","nf","novel","estaba leyendo una novela de terror",91,"2527","NA","NA","NA"
1119,"intenso","adj","intense, acute","estaban poseídos por un sueño muy intenso de independencia",99,"1209","NA","NA","NA"
2472,"fumar","v","to smoke","en vez de fumar, masca el tabaco",79,"964","NA","NA","low"
2230,"acá","adv","here, around here","estuve por acá el sábado pasado",80,"1588","high","NA","low"
2280,"juntar","v","to bring together","nos reunimos para juntar la plata para comprar la lotería",81,"696","NA","NA","low"
876,"intención","nf","intention","comunicó a los dueños su intención de comprarles el piso",100,"1420","NA","NA","NA"
1954,"secreto","nm","secret","¿cuál es el secreto de la longevidad de su voz?",89,"1124","NA","NA","NA"
344,"falta","nf","lack, shortage","sería una locura, una falta de ese sentido de la realidad",100,"3789","NA","NA","NA"
1824,"pájaro","nm","bird","parece un pájaro volando en el cielo",89,"1153","NA","NA","NA"
1536,"registrar","v","to register, record","se dedicaron a registrar y a conservar la herencia folclórica",94,"1214","NA","NA","NA"
810,"perfecto","adj","perfect","queríamos encontrar el sitio perfecto",98,"1584","NA","NA","NA"
1773,"setenta","num","seventy","en mayo, cumpliré los setenta años",91,"700","high","NA","NA"
1715,"primario","adj","primary","la producción del sector primario continúa siendo muy importante",95,"971","NA","NA","NA"
1297,"kilómetro","nm","kilometer","¿sabes cuánto es un kilómetro de distancia?",95,"1264","NA","NA","NA"
2299,"distribución","nf","distribution","quiere controlar personalmente la distribución de sus libros",88,"778","NA","low","NA"
2329,"centímetro","nm","centimeter","un metro de profundidad y sesenta centímetros de ancho",83,"561","NA","NA","NA"
1865,"espiritual","adj","spiritual","la vida espiritual puede ser una fuente de paz interior",93,"739","NA","NA","NA"
790,"viajar","v","to travel","le gustaba viajar en tren",99,"1468","NA","NA","NA"
1514,"tensión","nf","tension, stress, strain","nada me parecía serio, a pesar de la tensión y el anormal silencio",97,"959","NA","NA","NA"
937,"atravesar","v","to cross","para llegar al monte tenía que atravesar la pista caminando",100,"1224","NA","NA","NA"
589,"producto","nm","product","el arte es, en parte muy grande, producto de su época",100,"3425","NA","NA","NA"
334,"menor","adj","younger, youngest","E. era el menor de los hermanos",100,"3960","NA","NA","NA"
2554,"injusticia","nf","injustice","como un hombre ante la adversidad, contra la injusticia y la tiranía",86,"349","NA","NA","NA"
1534,"rendir","v","[se] to give in; to render","habría caído de rodillas para rendir tributo a la obra",96,"629","NA","NA","NA"
827,"elección","nf","election, choice","este año tendremos elección de 10 gobernadores",99,"3018","NA","NA","NA"
1388,"conducta","nf","conduct, behavior","no encontraba en su conducta algo que mereciese un golpe tan brutal",97,"1401","NA","NA","NA"
939,"perro","nm","dog","el gato, el perro y los pollos fueron domesticados muy pronto",96,"2139","NA","NA","NA"
1755,"tío","nm","uncle, guy","a otra pradera, donde vivían sus tíos y sus primas",82,"2352","high","NA","low"
1539,"atribuir","v","to attribute","de no saber a qué atribuir semejante aire optimista",96,"802","NA","NA","NA"
305,"suponer","v","to suppose, assume","era absurdo suponer que la guerrilla cambiara sus planes",100,"4114","NA","NA","NA"
913,"peligro","nm","danger, menace","ante el peligro de la muerte, Douglas recordó toda su vida",99,"1610","NA","NA","NA"
977,"exactamente","adv","exactly","quedan exactamente dos segundos y seis décimas",96,"1626","high","NA","NA"
1261,"americano","adj","American","¿viste las series americanas que dan por televisión?",95,"1533","high","NA","NA"
